{
  "$schema": "../../schema/provenance.schema.json",
  "class": "synthesized",
  "license": "MIT",
  "sources": [
    {
      "name": "Inclusive Design Skills",
      "url": "https://github.com/Owl-Listener/inclusive-design-skills",
      "license": "MIT",
      "role": "inspiration",
      "verifiedAt": "2026-08-24"
    },
    {
      "name": "Web Content Accessibility Guidelines",
      "url": "https://www.w3.org/WAI/WCAG22/",
      "license": "W3C Software and Document License",
      "role": "reference",
      "verifiedAt": "2026-08-24"
    }
  ],
  "notes": "Original form workflow synthesized from public inclusive-design patterns and WCAG references; no upstream prose copied."
}
