{
  "$schema": "../../schema/provenance.schema.json",
  "class": "synthesized",
  "license": "MIT",
  "sources": [
    {
      "name": "WAI-ARIA Authoring Practices",
      "url": "https://github.com/w3c/aria-practices",
      "license": "W3C Software and Document License",
      "role": "reference",
      "verifiedAt": "2026-08-24"
    },
    {
      "name": "Inclusive Design Skills",
      "url": "https://github.com/Owl-Listener/inclusive-design-skills",
      "license": "MIT",
      "role": "inspiration",
      "verifiedAt": "2026-08-24"
    },
    {
      "name": "Radix Primitives",
      "url": "https://github.com/radix-ui/primitives",
      "license": "MIT",
      "role": "reference",
      "verifiedAt": "2026-08-24"
    }
  ],
  "notes": "Original inclusive-design workflow synthesized from public standards and open-source references; no upstream prose or code copied."
}
