{
  "$schema": "../../schema/provenance.schema.json",
  "class": "synthesized",
  "license": "MIT",
  "sources": [
    {
      "name": "Impeccable",
      "url": "https://github.com/pbakaus/impeccable",
      "license": "Apache-2.0",
      "role": "inspiration",
      "verifiedAt": "2026-08-24"
    },
    {
      "name": "Vercel Agent Skills",
      "url": "https://github.com/vercel-labs/agent-skills",
      "license": "MIT",
      "role": "inspiration",
      "verifiedAt": "2026-08-24"
    },
    {
      "name": "Radix Primitives",
      "url": "https://github.com/radix-ui/primitives",
      "license": "MIT",
      "role": "reference",
      "verifiedAt": "2026-08-24"
    }
  ],
  "notes": "Original system-audit workflow informed by public open-source design and component practices; no upstream prose or code copied."
}
